{
  "schema_version": "1.0.0",
  "checkpoint_version": "training-checkpoint-v1",
  "checkpoint_id": "checkpoint-01",
  "experiment_id": "experiment-01",
  "architecture_id": "mlp-v1",
  "reward": {
    "dsl_version": "reward-dsl-v1",
    "catalog_version": "reward-catalog-v1",
    "source_sha256": "0000000000000000000000000000000000000000000000000000000000000000"
  },
  "contracts": {
    "engine_version": "0.1.0",
    "rules_version": "1.0.0",
    "map_id": "arena_mvp_v1",
    "action_version": "1.0.0",
    "observation_version": "rl-observation-v1"
  },
  "files": {
    "checkpoint.pt": "0000000000000000000000000000000000000000000000000000000000000000"
  },
  "created_at": "2026-09-11T12:00:00Z"
}
